{
  "$schema": "https://json-schema.org/draft/2020-12/schema",
  "$id": "https://github.com/pooryam92/awesome-dutch-ai-extensions/raw/main/schema.json",
  "title": "Dutch AI extension listing",
  "description": "One file per listing in data/listings/, named <id>.json. Every field is required except `endpoint`, which only a hosted listing can carry.",
  "type": "object",
  "additionalProperties": false,
  "required": [
    "id",
    "name",
    "category",
    "description_en",
    "description_nl",
    "subject",
    "contains",
    "execution",
    "uses",
    "origin",
    "status",
    "publisher",
    "source_url",
    "last_checked"
  ],
  "properties": {
    "id": {
      "type": "string",
      "pattern": "^[a-z0-9]+(-[a-z0-9]+)*$",
      "description": "Stable slug, and the filename."
    },
    "name": {
      "type": "string",
      "minLength": 1,
      "description": "Untranslated (MCP/skill/Claude/etc. stay as-is)."
    },
    "category": {
      "type": "string",
      "pattern": "^[a-z0-9]+(-[a-z0-9]+)*$",
      "description": "Key from data/categories.json."
    },
    "description_en": {
      "type": "string",
      "minLength": 1,
      "maxLength": 200,
      "description": "One outcome-first sentence, at most 200 characters."
    },
    "description_nl": {
      "type": "string",
      "minLength": 1,
      "maxLength": 200,
      "description": "Dutch mirror of description_en: one outcome-first sentence, same register, at most 200 characters. Product/vendor names stay untranslated."
    },
    "subject": {
      "type": "array",
      "minItems": 1,
      "uniqueItems": true,
      "items": {
        "type": "string",
        "pattern": "^[a-z0-9]+(-[a-z0-9]+)*$"
      },
      "description": "Keys from data/subjects.json of the Dutch service, data source, standard, or authority this integration lets an agent reach or work with; the outcome axis listings are grouped and searched by."
    },
    "contains": {
      "type": "object",
      "additionalProperties": false,
      "required": [
        "skills",
        "commands",
        "agents",
        "mcp_servers"
      ],
      "anyOf": [
        { "properties": { "skills": { "minItems": 1 } } },
        { "properties": { "commands": { "minItems": 1 } } },
        { "properties": { "agents": { "minItems": 1 } } },
        { "properties": { "mcp_servers": { "minItems": 1 } } }
      ],
      "$comment": "All four arrays empty would mean a listing that gives you nothing, which is never a real submission — and it is the shape that makes the derived kind fall through to `bundle`.",
      "description": "Everything the listing gives you, each kind in its own array, so the capabilities inside a single row stay findable. All four arrays are required and at least one carries a name — a listing that holds nothing is not a listing. Empty means none of that kind. A listing lists itself: a lone MCP server carries its own server name under `mcp_servers`, a lone skill its own name under `skills`. Names follow the publisher, falling back to the listing's `id` where the publisher ships no name. For a large multi-jurisdiction bundle, list only the Dutch-relevant entries. What kind of thing a listing is is read off these arrays — one kind is that kind, several is a bundle — rather than stored a second time.",
      "properties": {
        "skills": {
          "type": "array",
          "uniqueItems": true,
          "items": {
            "type": "string",
            "minLength": 1
          },
          "description": "Skill names as the publisher ships them — the directory holding each SKILL.md. Shared-resource pseudo-skills (`_shared`) are infrastructure, not capabilities; leave them out."
        },
        "commands": {
          "type": "array",
          "uniqueItems": true,
          "items": {
            "type": "string",
            "minLength": 1
          },
          "description": "Slash-command names without the leading slash — the basename of each file in `commands/`."
        },
        "agents": {
          "type": "array",
          "uniqueItems": true,
          "items": {
            "type": "string",
            "minLength": 1
          },
          "description": "Subagent names — the basename of each file in `agents/`."
        },
        "mcp_servers": {
          "type": "array",
          "uniqueItems": true,
          "items": {
            "type": "string",
            "minLength": 1
          },
          "description": "Keys from the `mcpServers` config that serve the listing's purpose, including the listing's own server where the listing is one. The publisher's own ops plumbing (monitoring, admin backends) is not a capability; leave it out."
        }
      }
    },
    "execution": {
      "type": "string",
      "enum": [
        "local",
        "remote",
        "both",
        "none"
      ],
      "description": "Where the code has to execute: `local` is a process on the visitor's own machine (stdio — `npx`, `uvx`, `docker run`), `remote` is an HTTPS server the publisher already runs, `both` is the same server offered either way, `none` is a listing that runs nothing, such as instructions you copy in. A server that merely *supports* an HTTP transport is still `local` — what makes a listing `remote` is that a URL exists to paste, not that one could be made to exist. It decides whether a listing can be used at all: products that register a server from their own cloud cannot spawn a local process, so a `local` listing is unreachable there whatever the visitor does. A listing whose parts disagree takes the value of its most restrictive part — any local-only server in a bundle makes the listing `local`. Read it off the source; it follows neither the host nor `contains`. `none` means nothing executes, never that nobody checked, which is why a listing carrying an `mcp_servers` entry may not claim it."
    },
    "uses": {
      "type": "array",
      "uniqueItems": true,
      "description": "Every external party the listing reaches, one entry per registrable domain, empty where it reaches none. Each entry says whether an account there stands between the visitor and the listing — a row rather than a bare list of required accounts, so the record can also say that a listing reaches an open service freely.",
      "items": {
        "type": "object",
        "additionalProperties": false,
        "required": [
          "domain",
          "account"
        ],
        "properties": {
          "domain": {
            "type": "string",
            "pattern": "^([a-z0-9]([a-z0-9-]*[a-z0-9])?\\.)+[a-z]{2,}$",
            "description": "The registrable domain of the party — never the portal subdomain that happens to issue the key: NS hands out keys at apiportal.ns.nl and the value here is `ns.nl`. Where a service runs a separate country domain, name the one a Dutch visitor signs in to (`exactonline.nl`). Nothing but this rule enforces the grain, since a pattern cannot know which label is registrable."
          },
          "account": {
            "type": "boolean",
            "description": "Whether the visitor must already hold an account here before the listing does anything. It records that an account stands in the way, not what it costs: a free self-serve developer key and a paid subscription are the same `true`, because price is a fact about the service and is not stored per listing. Not derivable from `subject` — two listings covering the same service can differ, because one queries its own copy."
          }
        }
      }
    },
    "origin": {
      "type": "string",
      "enum": [
        "official",
        "commercial",
        "community"
      ]
    },
    "status": {
      "type": "string",
      "enum": [
        "live",
        "beta",
        "preview",
        "concept",
        "abandoned",
        "broken"
      ],
      "description": "How far along the listing is, read off the source by the ladder in CONTRIBUTING.md. `live`, `beta`, `preview` and `concept` are a maturity ladder, and every value on it but `live` comes from the publisher's own words — a README calling it beta, an *Alpha* heading, a disclaimer. `abandoned` and `broken` sit off that ladder and record observed conditions: `abandoned` needs the publisher to say so, and `broken` means the documented install does not run while another route does.",
      "$comment": "`broken` is appended rather than slotted in so the enum order still reads as the ladder followed by the two terminal conditions."
    },
    "publisher": {
      "type": "string",
      "minLength": 1,
      "description": "Who built it."
    },
    "source_url": {
      "type": "string",
      "format": "uri",
      "description": "Canonical repo / vendor / package page."
    },
    "endpoint": {
      "type": "string",
      "format": "uri",
      "pattern": "^https://",
      "description": "A verified, publisher-documented HTTPS connection URL for a `remote` or `both` listing, including when source_url already shows it. Verify the MCP handshake or a documented authentication challenge; the latter does not establish tool functionality. Store the address itself, never a documentation page, credentials or a tenant-specific template. Omit it for connector bundles with no single address of their own."
    },
    "last_checked": {
      "type": "string",
      "format": "date",
      "description": "ISO date of last verification."
    }
  },
  "allOf": [
    {
      "$comment": "A listing that carries an MCP server executes something, so it cannot claim nothing does.",
      "if": {
        "required": ["contains"],
        "properties": {
          "contains": {
            "type": "object",
            "required": ["mcp_servers"],
            "properties": {
              "mcp_servers": { "type": "array", "minItems": 1 }
            }
          }
        }
      },
      "then": {
        "properties": {
          "execution": {
            "enum": ["local", "remote", "both"]
          }
        }
      }
    },
    {
      "$comment": "An endpoint is an address to paste, and only a hosted listing has one.",
      "if": { "required": ["endpoint"] },
      "then": { "properties": { "execution": { "enum": ["remote", "both"] } } }
    }
  ]
}
