{
  "id": "mcp-developer-overheid-api-register",
  "name": "mcp-developer-overheid-api-register",
  "category": "overheid",
  "description_en": "Search the developer.overheid.nl API Register for Dutch government APIs and their source repositories.",
  "description_nl": "Zoek in het API Register van developer.overheid.nl naar Nederlandse overheids-API's en hun broncode-repositories.",
  "subject": [
    "developer-overheid-register"
  ],
  "contains": {
    "skills": [],
    "commands": [],
    "agents": [],
    "mcp_servers": [
      "developer-overheid-api-register"
    ]
  },
  "execution": "local",
  "uses": [
    {
      "domain": "overheid.nl",
      "account": false
    }
  ],
  "origin": "community",
  "status": "live",
  "publisher": "David Stotijn",
  "source_url": "https://github.com/dstotijn/mcp-developer-overheid-api-register",
  "last_checked": "2026-08-14"
}
