{
  "id": "kamernet-mcp",
  "name": "kamernet-mcp",
  "category": "wonen",
  "description_en": "Search Kamernet for rooms, studios and apartments within your budget, compare rent, deposits and address-registration options, and check new listings.",
  "description_nl": "Zoek kamers, studio’s en appartementen op Kamernet binnen je budget, vergelijk huur, borg en inschrijfmogelijkheden en bekijk nieuw aanbod.",
  "subject": [
    "kamernet"
  ],
  "contains": {
    "skills": [],
    "commands": [],
    "agents": [],
    "mcp_servers": [
      "kamernet"
    ]
  },
  "execution": "local",
  "uses": [
    {
      "domain": "kamernet.nl",
      "account": false
    }
  ],
  "origin": "community",
  "status": "beta",
  "publisher": "jasp-nerd",
  "source_url": "https://github.com/jasp-nerd/kamernet-mcp",
  "last_checked": "2026-09-09"
}
