{
  "id": "moneybird-mcp",
  "name": "Moneybird MCP",
  "category": "boekhouding",
  "description_en": "View your Moneybird accounts and create or update contacts, invoices and time entries.",
  "description_nl": "Bekijk je Moneybird-administratie en maak of wijzig contacten, facturen en uren.",
  "subject": [
    "moneybird"
  ],
  "contains": {
    "skills": [],
    "commands": [],
    "agents": [],
    "mcp_servers": [
      "Moneybird"
    ]
  },
  "execution": "remote",
  "uses": [
    {
      "domain": "moneybird.com",
      "account": true
    }
  ],
  "origin": "official",
  "status": "live",
  "publisher": "Moneybird",
  "source_url": "https://developer.moneybird.com/tools/mcp",
  "last_checked": "2026-09-09"
}
