{
  "id": "nis2-msp-skillset",
  "name": "NIS2 MSP-skillset",
  "category": "recht",
  "description_en": "Help IT service clients assess NIS2 scope and incident reporting, discuss their quickscan report and set up the quickscan for sale under your own brand.",
  "description_nl": "Help als IT-dienstverlener klanten met NIS2-scope en incidentmeldingen, bespreek hun quickscanrapport en richt de quickscan in voor verkoop onder je eigen naam.",
  "subject": [
    "nis2"
  ],
  "contains": {
    "skills": [
      "nis2-scope-check",
      "nis2-meldplicht-coach",
      "nis2-rapport-adviseur",
      "nis2-installatie",
      "nis2-crm-koppeling",
      "nis2-msp-gtm"
    ],
    "commands": [],
    "agents": [],
    "mcp_servers": []
  },
  "execution": "none",
  "uses": [],
  "origin": "commercial",
  "status": "live",
  "publisher": "Dxfferent",
  "source_url": "https://github.com/Dxfferent/nis2-quickscan",
  "last_checked": "2026-09-09"
}
