{
  "id": "mcp-picnic",
  "name": "mcp-picnic",
  "category": "boodschappen",
  "description_en": "Find products, offers and recipes at Picnic, fill your cart, check delivery slots and track your order and driver.",
  "description_nl": "Zoek producten, aanbiedingen en recepten bij Picnic, vul je mandje, bekijk bezorgmomenten en volg je bestelling en de bezorger.",
  "subject": [
    "picnic"
  ],
  "contains": {
    "skills": [],
    "commands": [],
    "agents": [],
    "mcp_servers": [
      "picnic"
    ]
  },
  "execution": "local",
  "uses": [
    {
      "domain": "picnicinternational.com",
      "account": true
    },
    {
      "domain": "picnic.app",
      "account": false
    }
  ],
  "origin": "community",
  "status": "live",
  "publisher": "ivo-toby",
  "source_url": "https://github.com/ivo-toby/mcp-picnic",
  "last_checked": "2026-09-09"
}
