{
  "id": "nl-tax-agent-skills",
  "name": "nl-tax-agent-skills",
  "category": "geld",
  "description_en": "Prepare your 2025 Dutch income tax return or 2026 provisional assessment with sources for each field.",
  "description_nl": "Bereid je inkomstenbelasting 2025 of voorlopige aanslag 2026 voor met bronnen per aangifteveld.",
  "subject": [
    "belastingdienst"
  ],
  "contains": {
    "skills": [
      "nl-tax-annual-return",
      "nl-tax-box1-home",
      "nl-tax-box2",
      "nl-tax-box3",
      "nl-tax-evidence-indexer",
      "nl-tax-field-mapper",
      "nl-tax-intake",
      "nl-tax-partner-deductions",
      "nl-tax-provisional-assessment",
      "nl-tax-submit-companion",
      "nl-tax-winst"
    ],
    "commands": [],
    "agents": [
      "nl-tax-specialist-reviewer"
    ],
    "mcp_servers": []
  },
  "execution": "none",
  "uses": [],
  "origin": "community",
  "status": "live",
  "publisher": "cyanxxy",
  "source_url": "https://github.com/cyanxxy/nl-tax-agent-skills",
  "last_checked": "2026-09-09"
}
