{
  "id": "marktplaats-mcp-jasp-nerd",
  "name": "marktplaats-mcp (jasp-nerd)",
  "category": "spullen",
  "description_en": "Search Marktplaats and 2dehands, check seller ratings and verification, and find ads posted since your previous search.",
  "description_nl": "Zoek op Marktplaats en 2dehands, bekijk verkopersbeoordelingen en verificaties en vind advertenties die sinds je vorige zoekopdracht zijn geplaatst.",
  "subject": [
    "marktplaats"
  ],
  "contains": {
    "skills": [],
    "commands": [],
    "agents": [],
    "mcp_servers": [
      "marktplaats"
    ]
  },
  "execution": "both",
  "uses": [
    {
      "domain": "marktplaats.nl",
      "account": false
    },
    {
      "domain": "2dehands.be",
      "account": false
    }
  ],
  "origin": "community",
  "status": "beta",
  "publisher": "jasp-nerd",
  "source_url": "https://github.com/jasp-nerd/marktplaats-mcp",
  "last_checked": "2026-09-09"
}
