{
  "id": "nl-gov-mcp",
  "name": "nl-gov-mcp",
  "category": "overheid",
  "description_en": "Combine statistics, parliamentary documents, court rulings and other Dutch government data with source references.",
  "description_nl": "Combineer cijfers, Kamerstukken, uitspraken en andere Nederlandse overheidsdata met bronverwijzingen.",
  "subject": [
    "cbs-statline",
    "rdw",
    "knmi",
    "rechtspraak",
    "pdok",
    "kadaster",
    "rce",
    "wetten-overheid",
    "ovapi",
    "ns",
    "data-overheid-nl",
    "tweede-kamer",
    "duo",
    "bag",
    "tenderned",
    "officiele-bekendmakingen"
  ],
  "contains": {
    "skills": [],
    "commands": [],
    "agents": [],
    "mcp_servers": [
      "nl-gov-mcp"
    ]
  },
  "execution": "local",
  "uses": [
    {
      "domain": "overheid.nl",
      "account": false
    },
    {
      "domain": "cbs.nl",
      "account": false
    },
    {
      "domain": "tweedekamer.nl",
      "account": false
    },
    {
      "domain": "rijksoverheid.nl",
      "account": false
    },
    {
      "domain": "rijksbegroting.nl",
      "account": false
    },
    {
      "domain": "duo.nl",
      "account": false
    },
    {
      "domain": "onderwijsregistratie.nl",
      "account": false
    },
    {
      "domain": "knmi.nl",
      "account": true
    },
    {
      "domain": "pdok.nl",
      "account": false
    },
    {
      "domain": "kadaster.nl",
      "account": false
    },
    {
      "domain": "rechtspraak.nl",
      "account": false
    },
    {
      "domain": "rdw.nl",
      "account": false
    },
    {
      "domain": "luchtmeetnet.nl",
      "account": false
    },
    {
      "domain": "rijkswaterstaat.nl",
      "account": false
    },
    {
      "domain": "ndw.nu",
      "account": false
    },
    {
      "domain": "openraadsinformatie.nl",
      "account": false
    },
    {
      "domain": "nationaalgeoregister.nl",
      "account": false
    },
    {
      "domain": "rivm.nl",
      "account": false
    },
    {
      "domain": "cultureelerfgoed.nl",
      "account": false
    },
    {
      "domain": "europa.eu",
      "account": false
    },
    {
      "domain": "broservices.nl",
      "account": false
    },
    {
      "domain": "ned.nl",
      "account": true
    },
    {
      "domain": "ep-online.nl",
      "account": true
    },
    {
      "domain": "ns.nl",
      "account": true
    },
    {
      "domain": "dnb.nl",
      "account": true
    },
    {
      "domain": "nza.nl",
      "account": false
    },
    {
      "domain": "ovapi.nl",
      "account": false
    },
    {
      "domain": "dcat-ap-donl.nl",
      "account": false
    },
    {
      "domain": "tenderned.nl",
      "account": false
    },
    {
      "domain": "verkiezingsuitslagen.nl",
      "account": false
    }
  ],
  "origin": "community",
  "status": "live",
  "publisher": "WAINUT",
  "source_url": "https://github.com/WAINUTAI/nl-gov-mcp",
  "last_checked": "2026-09-09"
}
