{
  "id": "marktplaats-2dehands-mcp",
  "name": "marktplaats-2dehands-mcp",
  "category": "spullen",
  "description_en": "Search Marktplaats and 2dehands, save searches to find new ads, read messages and view your own ads, favourites and bids.",
  "description_nl": "Zoek op Marktplaats en 2dehands, bewaar zoekopdrachten om nieuw aanbod te vinden, lees je berichten en bekijk je eigen advertenties, favorieten en biedingen.",
  "subject": [
    "marktplaats"
  ],
  "contains": {
    "skills": [],
    "commands": [],
    "agents": [],
    "mcp_servers": [
      "marktplaats-2dehands"
    ]
  },
  "execution": "local",
  "uses": [
    {
      "domain": "marktplaats.nl",
      "account": false
    },
    {
      "domain": "2dehands.be",
      "account": false
    }
  ],
  "origin": "community",
  "status": "live",
  "publisher": "gjoris",
  "source_url": "https://github.com/gjoris/marktplaats-2dehands-mcp",
  "last_checked": "2026-09-09"
}
