{
  "id": "wonen-energie-alternatieve-bronnen",
  "name": "wonen-energie-alternatieve-bronnen",
  "category": "wonen",
  "description_en": "Research housing and energy by neighbourhood using grid-operator data and PDOK/CBS maps and turn the findings into tables and charts.",
  "description_nl": "Onderzoek wonen en energie per buurt met netbeheerdata en PDOK/CBS-kaarten en maak tabellen en grafieken van de uitkomsten.",
  "subject": [
    "netbeheerdata",
    "pdok",
    "cbs-statline"
  ],
  "contains": {
    "skills": [
      "wonen-energie-alternatieve-bronnen"
    ],
    "commands": [],
    "agents": [],
    "mcp_servers": []
  },
  "execution": "local",
  "uses": [
    {
      "domain": "pdok.nl",
      "account": false
    },
    {
      "domain": "liander.nl",
      "account": false
    },
    {
      "domain": "ep-online.nl",
      "account": true
    },
    {
      "domain": "overheid.io",
      "account": true
    },
    {
      "domain": "partnersinenergie.nl",
      "account": true
    },
    {
      "domain": "databank.nl",
      "account": false
    },
    {
      "domain": "kadaster.nl",
      "account": false
    },
    {
      "domain": "overheid.nl",
      "account": false
    }
  ],
  "origin": "community",
  "status": "live",
  "publisher": "linksmith",
  "source_url": "https://github.com/linksmith/wonen-energie-alternatieve-bronnen",
  "last_checked": "2026-09-09"
}
