{
  "id": "mollie-mcp",
  "name": "Mollie MCP",
  "category": "bedrijf",
  "description_en": "Create payment links and manage payments, customers, invoices and subscriptions in Mollie.",
  "description_nl": "Maak betaallinks en beheer betalingen, klanten, facturen en abonnementen in Mollie.",
  "subject": [
    "mollie"
  ],
  "contains": {
    "skills": [],
    "commands": [],
    "agents": [],
    "mcp_servers": [
      "Mollie"
    ]
  },
  "execution": "remote",
  "uses": [
    {
      "domain": "mollie.com",
      "account": true
    }
  ],
  "origin": "official",
  "status": "live",
  "publisher": "Mollie",
  "source_url": "https://docs.mollie.com/docs/mollie-mcp-server",
  "endpoint": "https://mcp.mollie.com/mcp",
  "last_checked": "2026-09-14"
}
