{
  "id": "anwb-mcp",
  "name": "anwb-mcp",
  "category": "reizen",
  "description_en": "Check ANWB traffic jams and roadworks and plan driving, cycling or walking routes, including EV routes with charging stops.",
  "description_nl": "Bekijk ANWB-files en wegwerkzaamheden en plan auto-, fiets- of wandelroutes, inclusief routes met laadstops voor je elektrische auto.",
  "subject": [
    "anwb"
  ],
  "contains": {
    "skills": [],
    "commands": [],
    "agents": [],
    "mcp_servers": [
      "anwb-mcp"
    ]
  },
  "execution": "local",
  "uses": [
    {
      "domain": "anwb.nl",
      "account": false
    }
  ],
  "origin": "community",
  "status": "live",
  "publisher": "BartWaardenburg",
  "source_url": "https://github.com/BartWaardenburg/anwb-mcp",
  "last_checked": "2026-09-09"
}
