{
  "id": "baarn-raadsinformatie",
  "name": "baarn-raadsinformatie",
  "category": "overheid",
  "description_en": "Search Baarn council meetings, agendas and documents by keyword or meaning, using information from Notubiz.",
  "description_nl": "Doorzoek vergaderingen, agenda’s en raadsstukken van Baarn op trefwoord of betekenis, met informatie uit Notubiz.",
  "subject": [
    "gemeente-baarn"
  ],
  "contains": {
    "skills": [],
    "commands": [],
    "agents": [],
    "mcp_servers": [
      "baarn-raadsinformatie"
    ]
  },
  "execution": "local",
  "uses": [
    {
      "domain": "notubiz.nl",
      "account": false
    },
    {
      "domain": "raadsinformatie.nl",
      "account": false
    },
    {
      "domain": "baarn.nl",
      "account": false
    }
  ],
  "origin": "community",
  "status": "live",
  "publisher": "tiemenrtuinstra",
  "source_url": "https://github.com/tiemenrtuinstra/baarn-raadsinformatie",
  "last_checked": "2026-09-09"
}
