{
  "id": "dutch-finance-planner-skill",
  "name": "dutch-finance-planner-skill",
  "category": "geld",
  "description_en": "Build a monthly budget and action plan for saving, debt and retirement through a personal interview, taking Dutch taxes and benefits into account.",
  "description_nl": "Maak via een persoonlijk vraaggesprek een maandbudget en actieplan voor sparen, schulden en pensioen, met aandacht voor Nederlandse belastingen en toeslagen.",
  "subject": [
    "belastingdienst"
  ],
  "contains": {
    "skills": [
      "financial-planner"
    ],
    "commands": [],
    "agents": [],
    "mcp_servers": []
  },
  "execution": "none",
  "uses": [],
  "origin": "community",
  "status": "live",
  "publisher": "NautilusIT",
  "source_url": "https://github.com/jonnekleijer/dutch-finance-planner-skill",
  "last_checked": "2026-09-09"
}
