{
  "id": "afas-ai-connect",
  "name": "AFAS AI Connect",
  "category": "boekhouding",
  "description_en": "View outstanding items, balance sheets and profit and loss in AFAS Profit and prepare postings.",
  "description_nl": "Bekijk openstaande posten, balans en resultaat in AFAS Profit en bereid boekingen voor.",
  "subject": [
    "afas-profit"
  ],
  "contains": {
    "skills": [],
    "commands": [
      "afas-balans",
      "afas-omzet",
      "afas-openstaande-debiteuren",
      "afas-ouderdomsanalyse"
    ],
    "agents": [],
    "mcp_servers": [
      "afas"
    ]
  },
  "execution": "remote",
  "uses": [
    {
      "domain": "afas.online",
      "account": true
    },
    {
      "domain": "iwebdevelopment.com",
      "account": true
    }
  ],
  "origin": "commercial",
  "status": "live",
  "publisher": "iWebDevelopment",
  "source_url": "https://github.com/iwebdevnl/afas-ai-connect",
  "last_checked": "2026-09-09"
}
