{
  "id": "twinfield-mcp",
  "name": "Twinfield MCP",
  "category": "boekhouding",
  "description_en": "View Twinfield transactions, customers and suppliers and draft purchase invoices, sales invoices and journal entries.",
  "description_nl": "Bekijk Twinfield-boekingen, klanten en leveranciers en maak concepten voor inkoopfacturen, verkoopfacturen en memoriaalposten.",
  "subject": [
    "twinfield"
  ],
  "contains": {
    "skills": [],
    "commands": [],
    "agents": [],
    "mcp_servers": [
      "twinfield"
    ]
  },
  "execution": "local",
  "uses": [
    {
      "domain": "twinfield.com",
      "account": true
    }
  ],
  "origin": "community",
  "status": "live",
  "publisher": "CodeMill Solutions",
  "source_url": "https://github.com/CodeMill-Solutions/twinfield-mcp",
  "last_checked": "2026-09-09"
}
