{
  "id": "ictrecht-plugin-suite",
  "name": "ICTRecht Plugin Suite",
  "category": "recht",
  "description_en": "Review contracts, privacy issues and EU rules with workflows for each legal role.",
  "description_nl": "Beoordeel contracten, privacyvragen en Europese regels met werkwijzen per juridische rol.",
  "subject": [
    "avg",
    "ai-verordening",
    "nis2"
  ],
  "contains": {
    "skills": [
      "aansprakelijkheid",
      "advies-structuur",
      "ai-act-classificatie",
      "ai-ip",
      "algemene-voorwaarden",
      "ap-contact",
      "auteursrecht",
      "avg-rechten",
      "betrokkenen-contact",
      "cold-start-interview",
      "compliance-check",
      "contract-review",
      "cyberweerbaarheid-act",
      "data-act",
      "data-governance",
      "data-sharing",
      "datalek",
      "datalek-toets",
      "dataverdrag-analyse",
      "dma-analyse",
      "doorgifte",
      "doorgifte-advies",
      "dpia",
      "dpia-toets",
      "dsa-verplichtingen",
      "fg-advies",
      "fg-jaarverslag",
      "geschil-voorbereiding",
      "grondslag",
      "grondslag-advies",
      "handelsnaam-domeinnaam",
      "ie-clausules",
      "juridisch-memo",
      "merkenrecht",
      "nda-review",
      "nis2-check",
      "onderhandeling-prep",
      "open-data",
      "regelgeving-scan",
      "register-toets",
      "risico-analyse",
      "sla-review",
      "software-licenties",
      "toezichtsplan",
      "verwerkingsregister",
      "vok-review",
      "vok-toets"
    ],
    "commands": [],
    "agents": [],
    "mcp_servers": []
  },
  "execution": "none",
  "uses": [],
  "origin": "commercial",
  "status": "live",
  "publisher": "ICTRecht",
  "source_url": "https://github.com/ICTRecht/claude-plugin",
  "last_checked": "2026-09-09"
}
