{
  "id": "dutch-choropleth-maps",
  "name": "dutch-choropleth-maps",
  "category": "data",
  "description_en": "Map Dutch statistics by municipality, district or neighbourhood, using boundaries from the matching year and checking for missing data.",
  "description_nl": "Maak kaarten van Nederlandse cijfers per gemeente, wijk of buurt, met grenzen uit het juiste jaar en controle op ontbrekende gegevens.",
  "subject": [
    "pdok",
    "cbs-statline"
  ],
  "contains": {
    "skills": [
      "dutch-choropleth-maps"
    ],
    "commands": [],
    "agents": [],
    "mcp_servers": []
  },
  "execution": "none",
  "uses": [
    {
      "domain": "pdok.nl",
      "account": false
    },
    {
      "domain": "cartomap.github.io",
      "account": false
    }
  ],
  "origin": "community",
  "status": "live",
  "publisher": "linksmith",
  "source_url": "https://github.com/linksmith/dutch-choropleth-maps",
  "last_checked": "2026-09-09"
}
