{
  "id": "orderfood",
  "name": "orderfood",
  "category": "boodschappen",
  "description_en": "Find restaurants and menus on Uber Eats and Thuisbezorgd and fill your cart.",
  "description_nl": "Zoek restaurants en menu’s op Uber Eats en Thuisbezorgd en vul je mandje.",
  "subject": [
    "thuisbezorgd"
  ],
  "contains": {
    "skills": [],
    "commands": [],
    "agents": [],
    "mcp_servers": [
      "orderfood"
    ]
  },
  "execution": "local",
  "uses": [
    {
      "domain": "ubereats.com",
      "account": true
    },
    {
      "domain": "thuisbezorgd.nl",
      "account": false
    },
    {
      "domain": "jet-external.com",
      "account": true
    }
  ],
  "origin": "community",
  "status": "broken",
  "publisher": "henkas",
  "source_url": "https://github.com/henkas/orderfood",
  "last_checked": "2026-09-09"
}
