{
  "id": "bitvavo-mcp",
  "name": "bitvavo-mcp",
  "category": "geld",
  "description_en": "View the value, profit and loss of your Bitvavo holdings and include purchases and conversions made in the app by importing your transaction CSV.",
  "description_nl": "Bekijk de waarde, winst en verlies van je Bitvavo-bezit en neem aankopen en omwisselingen uit de app mee door je transactie-CSV te importeren.",
  "subject": [
    "bitvavo"
  ],
  "contains": {
    "skills": [],
    "commands": [],
    "agents": [],
    "mcp_servers": [
      "bitvavo"
    ]
  },
  "execution": "local",
  "uses": [
    {
      "domain": "bitvavo.com",
      "account": true
    }
  ],
  "origin": "community",
  "status": "live",
  "publisher": "aderik",
  "source_url": "https://github.com/aderik/bitvavo-mcp",
  "last_checked": "2026-09-09"
}
