{
  "id": "jortt-mcp",
  "name": "Jortt MCP",
  "category": "boekhouding",
  "description_en": "View your Jortt accounts, create invoices and book expenses.",
  "description_nl": "Bekijk je Jortt-boekhouding, maak facturen en boek uitgaven.",
  "subject": [
    "jortt"
  ],
  "contains": {
    "skills": [],
    "commands": [],
    "agents": [],
    "mcp_servers": [
      "jortt"
    ]
  },
  "execution": "remote",
  "uses": [
    {
      "domain": "jortt.nl",
      "account": true
    }
  ],
  "origin": "official",
  "status": "live",
  "publisher": "Jortt",
  "source_url": "https://www.jortt.nl/koppelingen/mcp-koppeling/",
  "last_checked": "2026-09-09"
}
