{
  "id": "ah-mcp",
  "name": "ah-mcp",
  "category": "boodschappen",
  "description_en": "Find AH products, Bonus and Vandaag-af clearance deals, fill your lists or cart, and view past orders and receipts.",
  "description_nl": "Zoek AH-producten, Bonus- en Vandaag-af-aanbiedingen, vul je lijstjes of winkelmandje en bekijk eerdere bestellingen en kassabonnen.",
  "subject": [
    "albert-heijn"
  ],
  "contains": {
    "skills": [],
    "commands": [],
    "agents": [],
    "mcp_servers": [
      "ah"
    ]
  },
  "execution": "local",
  "uses": [
    {
      "domain": "ah.nl",
      "account": true
    }
  ],
  "origin": "community",
  "status": "live",
  "publisher": "mrserzhan",
  "source_url": "https://github.com/mrserzhan/ah-mcp",
  "last_checked": "2026-09-09"
}
