{
  "id": "rdw-mcp",
  "name": "rdw-mcp",
  "category": "reizen",
  "description_en": "Get a vehicle report by Dutch licence plate with registration, fuel, emissions, axle and body data from open RDW records, as readable text and JSON.",
  "description_nl": "Vraag op kenteken een voertuigrapport op met registratie, brandstof, uitstoot, assen en carrosserie uit open RDW-data, als leesbare tekst en JSON.",
  "subject": [
    "rdw"
  ],
  "contains": {
    "skills": [],
    "commands": [],
    "agents": [],
    "mcp_servers": [
      "rdw"
    ]
  },
  "execution": "local",
  "uses": [
    {
      "domain": "rdw.nl",
      "account": false
    }
  ],
  "origin": "community",
  "status": "live",
  "publisher": "rantuma",
  "source_url": "https://github.com/rantuma/rdw-mcp",
  "last_checked": "2026-09-09"
}
